url,title,description,image,date,hnurl
https://oschvr.com/posts/what-id-like-as-sre/,Things I want as SRE/DevOps from Devs :: oschvr.com,"It has been a while since I&rsquo;ve been working as SRE/Platform/Cloud Engineer, and lately and I realize I&rsquo;ve been repeating some questions to developers that I rarely get an answer for straight away. These are not meant to make anyone&rsquo;s life harder, au contraire, the whole pourpose of having a solid answer to this list of questions, is to make everyone less worried about the probabilty of some high stakes, overnight failure or a data handling missuse that could potentially cause big losses, and of course a lot of unnecessary stress.",https://oschvr.s3.us-west-2.amazonaws.com/oldstreet.jpeg,2022-12-16T02:24:45.339147879Z,https://news.ycombinator.com/item?id=34006463
https://fabiensanglard.net/a_linux_evening/index.html,A Linux evening...,,,2022-12-16T12:57:21.293198595Z,https://news.ycombinator.com/item?id=34013195
https://www.techdirt.com/2022/12/16/elon-tries-badly-to-defend-the-banning-of-journalists-as-twitter-starts-blocking-links-mentions-of-mastodon/,Elon Tries (Badly) To Defend The Banning Of Journalists As Twitter Starts Blocking Links & Mentions Of Mastodon | Techdirt,"Look, I fucking warned Elon that this is exactly how it would go. It’s how it always goes. Remember Parler? They promised that they would moderate “based off the FCC and the Supreme cou…",https://www.techdirt.com/wp-content/themes/techdirt/assets/images/td-rect-logo-white.png,2022-12-17T05:28:09.827806809Z,https://news.ycombinator.com/item?id=34019596
https://www.theverge.com/2022/11/21/23471306/apple-books-ios-16-page-flip-animation-sucks,Apple’s taken the joy out of its Books app with iOS 16 - The Verge,The lovely page flip is gone.,https://cdn.vox-cdn.com/thumbor/s1cejsajVEIJSFOH6DjdVSw9KtU=/0x0:2040x1360/1200x628/filters:focal(1020x680:1021x681)/cdn.vox-cdn.com/uploads/chorus_asset/file/24020007/226270_iPHONE_14_PHO_akrales_0030.jpg,2022-12-17T18:12:31.605793746Z,https://news.ycombinator.com/item?id=34029914
https://worthdoingbadly.com/macdirtycow/,"Get root on macOS 13.0.1 with CVE-2022-46689, the macOS Dirty Cow bug | Worth Doing Badly","Get root on macOS 13.0.1 with CVE-2022-46689 (macOS equivalent of the Dirty Cow bug), using the testcase extracted from Apple’s XNU source.",,2022-12-17T21:35:32.59333555Z,https://news.ycombinator.com/item?id=34032402
https://smallstep.com/blog/reasons-not-to-use-public-certificate-authorities/,3 Reasons Why You Shouldn't Use Public CAs for Internal Infrastructures.,Public web certificate authorities like Let's Encrypt were not designed to support internal use cases. What you need is a private certificate authority.,https://smallstep.com/images/blog/3_Important_Reasons.jpg,2022-12-18T18:18:20.998075966Z,https://news.ycombinator.com/item?id=34036681
https://popehat.substack.com/p/in-defense-of-free-speech-pedantry?sd=pf,In Defense Of Free Speech Pedantry - by Ken White,Why You Should Clarify Which Free Speech Value You’re Debating,"https://substackcdn.com/image/fetch/w_1200,h_600,c_fill,f_jpg,q_auto:good,fl_progressive:steep,g_auto/https%3A%2F%2Fbucketeer-e05bbc84-baa3-437e-9518-adb32be77984.s3.amazonaws.com%2Fpublic%2Fimages%2F86210981-57ee-4051-840b-457837bd3a1a_628x670.jpeg",2022-12-18T20:08:41.145691937Z,
https://community.hachyderm.io/blog/2022/12/20/the-queues-%EF%B8%8F-down-in-queueville/,The Queues ☃️ down in Queueville | Hachyderm Community,"Hachyderm has experienced a minor unplanned degradation in our service. Here is the postmortem, analysis, and writeup on the incident.",,2022-12-21T05:13:16.871847352Z,
https://www.eff.org/deeplinks/2022/12/user-generated-content-and-fediverse-legal-primer,User Generated Content and the Fediverse: A Legal Primer | Electronic Frontier Foundation,"A growing number of people are experimenting with federated alternatives to social media like Mastodon, either by joining an “instance” hosted by someone else or creating their own instance by running the free, open-source software on a server they control. (See more about this movement and joining...",https://www.eff.org/files/banner_library/public-interest-internet-2.jpg,2022-12-21T05:52:38.659553984Z,
https://www.cyclist.co.uk/in-depth/11046/bike-frame-stiffness,Bike frame stiffness: Why it matters and all you need to know | Cyclist,"Lighter, more aero, stiffer… but how does bike frame stiffness actually affect your ride? And is more always better?",https://cyclist.b-cdn.net/sites/cyclist/files/2022/12/stiffness_01.jpg,2022-12-22T00:19:42.944306682Z,https://news.ycombinator.com/item?id=34079516
https://brev.dev/blog/ai-wont-replace-you-write-bash,Using ChatGPT to make Bash palatable | Brev docs,Using ChatGPT to make Bash palatable | Brev docs,https://uohmivykqgnnbiouffke.supabase.co/storage/v1/object/public/landingpage/thumbnail-main.png,2022-12-22T00:21:59.259207328Z,https://news.ycombinator.com/item?id=34085906
https://www.electrive.net/2022/12/22/mercedes-eqe-im-test-fuer-viel-reichweite-muss-es-kein-tesla-mehr-sein/,Mercedes EQE im Test: Für viel Reichweite muss es kein Tesla mehr sein - electrive.net,Die Angst nach zu wenig Reichweite ist längst vorbei. Für einen großen Aktionsradius und Effizienz muss es zudem kein Tesla mehr sein. Denn abseits der E-SUV bieten die deutschen Autobauer mittlerweile konkurrenzfähige Limousinen an. Eines dieser Modelle ist der Mercedes EQE. Doch wie gut ist die elektrische Interpretation der E-Klasse?…,https://www.electrive.net/wp-content/uploads/2022/12/mercedes-benz-eqe-350-plus-fahrbericht-daniel-boennighausen-2022-01-min.png,2022-12-22T13:59:23.800985751Z,
https://www.thefp.com/p/an-elegy-to-all-my-crap,O Holy Crap,"My local Montana landfill is full of the remains of short-lived coffee grinders, pens, peelers, laptops. After Christmas, I’ll need to reserve a bigger plot.","https://substackcdn.com/image/fetch/f_auto,q_auto:good,fl_progressive:steep/https%3A%2F%2Fbucketeer-e05bbc84-baa3-437e-9518-adb32be77984.s3.amazonaws.com%2Fpublic%2Fimages%2Fb8e3fc0a-4aff-47d4-bc2a-51a79bbadc9f_3000x2000.jpeg",2022-12-22T14:19:06.259338521Z,https://news.ycombinator.com/item?id=34092749
https://taskandpurpose.com/history/us-army-nuts-bastogne-surrender/,The story of 'Nuts!' — When an American general refused to surrender,"On Dec. 22, 1944, 4 German soldiers walked to American lines in Bastogne, Belgium with a message asking for surrender. The general said no.",https://taskandpurpose.com/uploads/2020/12/22/nuts-feat.jpg?auto=webp,2022-12-22T18:07:00.404059789Z,
https://journal.paoloamoroso.com/reading-writing-an-interpreter-in-go,Reading Writing an Interpreter in Go — Paolo Amoroso's Journal,"I'm reading the book Writing An Interpreter In Go by Thorsten Ball, which I got along with the sequel Writing A Compiler In Go.  I have a...",https://cdn.writeas.net/img/w-sq-light.png,2022-12-22T20:32:21.71660769Z,
https://www.openculture.com/2017/12/thelonious-monks-25-tips-for-musicians-1960.html,Thelonious Monk's 25 Tips for Musicians (1960) | Open Culture,Stories of idiosyncratic and demanding composers and bandleaders abound in mid-century jazz—of pioneers who pushed their musicians to new heights and in entirely new directions through seeming sheer force of will. Miles Davis’ name inevitably comes up in such discussions.,http://cdn8.openculture.com/wp-content/uploads/2012/09/08210005/monk-tips-for-a-gig-fb.png,2022-12-22T20:47:41.581494871Z,https://news.ycombinator.com/item?id=34090486
https://newsletter.mollywhite.net/p/issue-14-ftx-friends-flip-on-fellow,Issue 14 – FTX friends flip on fellow fraudster,"SBF is in the US, where he has been released on bail. Meanwhile, two top executives are cooperating with the investigation and have pled guilty to their charges.","https://substackcdn.com/image/fetch/w_1200,h_600,c_limit,f_jpg,q_auto:good,fl_progressive:steep/https%3A%2F%2Fbucketeer-e05bbc84-baa3-437e-9518-adb32be77984.s3.amazonaws.com%2Fpublic%2Fimages%2Fa56e373f-62c4-43a0-978a-46c1d579cfa6_1300x654.png",2022-12-22T21:30:38.055737666Z,
https://twitch.nervestaple.com/2022/12/19/pc-in-macse-build/,Assembling a PC in an old Macintosh SE Case,,,2022-12-23T05:45:47.875959127Z,
https://catvalente.substack.com/p/stop-talking-to-each-other-and-start,Stop Talking to Each Other and Start Buying Things: Three Decades of Survival in the Desert of Social Media,I bet you're wondering how we got here...,,2022-12-23T15:05:04.677560975Z,https://news.ycombinator.com/item?id=34101694
https://www.teslarati.com/tesla-placed-bottom-consumer-reports-reliability-rankings/,Tesla crushed in Consumer Reports reliability rankings despite improvement,"Consumer Reports released their annual reliability rankings, and Tesla fell to near the bottom of the list despite improving considerably.",https://www.teslarati.com/wp-content/uploads/2022/10/Tesla-Q4-2022-earnings-photos-Giga-Berlin-MY-GA-1.jpg,2022-12-23T15:13:11.762041921Z,
https://www.niemanlab.org/2022/12/this-is-the-year-of-the-rss-reader-really/,This is the year of the RSS reader. (Really!) » Nieman Journalism Lab,"""Contrary to what The New York Times has speculated, we are not at peak newsletter. We are just at peak newsletter via email delivery.""",https://www.niemanlab.org/images/nikkiusher-1.jpeg,2022-12-23T17:31:33.756871278Z,https://news.ycombinator.com/item?id=34105572
https://rachelandrew.co.uk/archives/2022/12/23/thank-you-an-event-apart/,Thank you An Event Apart – Rachel Andrew,,,2022-12-23T21:38:41.227646227Z,
https://www.caranddriver.com/news/a42306568/toyota-prius-catalytic-converter-guard/,Toyota Prius Gets a $140 Catalytic Converter Guard to Protect It,"A company called Cat Shield is selling the aluminum shield not only for the Prius but also for many other Toyota models, including the Corolla, RAV4, and Tacoma.","https://hips.hearstapps.com/hmg-prod/images/2023-prius-xle-supersonicred-203-1671546076.jpg?crop=0.837xw:0.627xh;0,0.180xh&resize=1200:*",2022-12-24T18:03:49.105264054Z,
https://hackernoon.com/apples-icons-have-that-shape-for-a-very-good-reason-720d4e7c8a14,Apple’s Icons Have That Shape for a Very Good Reason | HackerNoon,"If you haven’t been immersed in <a href=""https://hackernoon.com/tagged/ios"" target=""_blank"">iOS</a> interface <a href=""https://hackernoon.com/tagged/design"" target=""_blank"">design</a>, you might look at Apple’s icons and think that they’re just a rounded square or a ‘roundrect’. If you’ve been designing icons, you know that they’re something different and may have heard the word <a href=""https://applypixels.com/the-hunt-for-the-squircle/"" target=""_blank"">squircle</a> used (mathematical intermediate of a square and a circle). And if you’re an Industrial Designer, you recognize this as a core signature of their hardware products.",,2022-12-24T18:39:57.200914273Z,https://news.ycombinator.com/item?id=34115041
https://squidgeefish.com/projects/rotary-keyboard/,Rotary Keyboard | Squidgeefish,Bodging a rotary dial into a mechanical keyboard,http://squidgeefish.com/assets/rotary-keyboard/banner.jpg,2022-12-24T18:51:37.968052321Z,https://news.ycombinator.com/item?id=34115747
https://medium.com/@kris-nova/why-fix-kubernetes-and-systemd-782840e50104,Why fix Kubernetes and Systemd?. Learn why and how the Aurae Runtime… | by Kris Nóva | Medium,Learn why and how the Aurae Runtime project aims to replace parts of Kubernetes and Systemd.,https://miro.medium.com/max/1000/0*snNp4H00rz_5uZ58,2022-12-25T14:28:37.544901827Z,https://news.ycombinator.com/item?id=32888538
https://www.techdirt.com/2022/12/26/elon-musk-claims-hes-not-worried-about-the-ftc-he-should-be/,Elon Musk Claims He’s Not Worried About The FTC; He Should Be | Techdirt,"Soon after Elon took over Twitter and fired everyone, we wondered (somewhat jokingly) if there was anyone left at the company who was aware of the FTC’s consent decree with the company, signe…",https://www.techdirt.com/wp-content/themes/techdirt/assets/images/td-rect-logo-white.png,2022-12-27T02:42:27.211279096Z,
https://www.maxwellrules.com/misc/nvim_jupyter.html,Maxwell Rules - NeoVim Notebooks,,,2022-12-27T14:22:24.331097821Z,https://news.ycombinator.com/item?id=34145680
https://statuskuo.substack.com/p/george-santos-confessed-to-lying?sd=pf,"George Santos Confessed to Lying, But There’s a Lot More Out There. And It’s Really Weird.","George Santos, the embattled representative-elect for New York’s 3rd Congressional District, has fessed up. Well, somewhat. After a New York Times exposé broke a week ago calling much of Santos’s background into question, including his claims of where he went to college, where he’s worked, and even whether he had a criminal background and was actually a fugitive from Brazil—allegations which Santos’s attorney claimed at the time were a “shotgun blast of attacks” aimed at “smearing his good name”—the 34-year old fabulist tried to close the story with a heartfelt","https://substackcdn.com/image/fetch/w_1200,h_600,c_limit,f_jpg,q_auto:good,fl_progressive:steep/https%3A%2F%2Fbucketeer-e05bbc84-baa3-437e-9518-adb32be77984.s3.amazonaws.com%2Fpublic%2Fimages%2Fe8bdcf21-9e62-4785-9a22-82b7abf4f206_2560x1708.webp",2022-12-27T19:52:45.081047405Z,
https://palant.info/2022/12/26/whats-in-a-pr-statement-lastpass-breach-explained/,What’s in a PR statement: LastPass breach explained | Almost Secure,"The LastPass statement on their latest breach is full of omissions, half-truths and outright lies. I’m providing the necessary context for some of their claims.",https://palant.info/2022/12/26/whats-in-a-pr-statement-lastpass-breach-explained/statement.png,2022-12-27T20:09:43.328768578Z,https://news.ycombinator.com/item?id=34147977
https://spectrum.ieee.org/satellite-cellphone,Your Cellphone Will Be a Satphone - IEEE Spectrum,Existing smartphones will connect with new satellite constellations in 2023,https://spectrum.ieee.org/media-library/a-3d-rendering-of-a-large-flat-satellite-orbiting-the-earth-with-the-sun-rising-over-the-horizon-behind-it.jpg?id=32315788&width=1200&height=600&coordinates=0%2C347%2C0%2C348,2022-12-28T01:04:38.866198148Z,https://news.ycombinator.com/item?id=34155783
https://andy-bell.co.uk/2023-the-year-of-websites/,"2023, the year of websites | Andy Bell",,,2022-12-28T03:52:53.238962518Z,https://news.ycombinator.com/item?id=34147530
https://www.techdirt.com/2022/12/28/lastpass-tries-to-bury-the-full-scope-of-its-disastrous-privacy-breach-behind-the-christmas-holiday/,LastPass Tries To Bury The Full Scope Of Its Disastrous Privacy Breach Behind The Christmas Holiday | Techdirt,"Back in August, password storage app LastPass vaguely admitted that hackers had accessed the company’s systems. In the company’s original August reveal, the company generally tap danced…",https://www.techdirt.com/wp-content/themes/techdirt/assets/images/td-rect-logo-white.png,2022-12-28T21:02:17.493209448Z,
https://www.seat31b.com/2022/12/the-great-southwest-meltdown-of-2022/,The Great Southwest Meltdown Of 2022 – Seat 31B,,,2022-12-28T21:16:02.442109646Z,
https://tedgioia.substack.com/p/what-can-we-learn-from-barnes-and,What Can We Learn from Barnes & Noble's Surprising Turnaround?,"Digital platforms are struggling, meanwhile a 136-year-old book retailer is growing again. But why?","https://substackcdn.com/image/fetch/w_1200,h_600,c_limit,f_jpg,q_auto:good,fl_progressive:steep/https%3A%2F%2Fbucketeer-e05bbc84-baa3-437e-9518-adb32be77984.s3.amazonaws.com%2Fpublic%2Fimages%2Fc0b32e6a-0ac5-454d-8f6f-3a241a948253_770x364.jpeg",2022-12-29T03:23:37.798196533Z,https://news.ycombinator.com/item?id=34165960
https://spectrum.ieee.org/rhumatoid-arthritis,A New Treatment for Arthritis: Vagus-Nerve Stimulation - IEEE Spectrum,Studies will soon show whether electroceuticals outperform pharmaceuticals,https://spectrum.ieee.org/media-library/a-tablet-computer-a-smartphone-a-grey-belt-with-white-stripes-a-grey-disc-and-a-small-silver-rectangle-with-a-wire-curled-be.jpg?id=32333913&width=1200&height=600&coordinates=0%2C356%2C0%2C356,2022-12-29T15:27:48.675825659Z,https://news.ycombinator.com/item?id=34163231
https://www.techdirt.com/2022/12/29/it-took-just-four-days-from-elon-gleefully-admitting-hed-unplugged-a-server-rack-for-twitter-to-have-a-major-outage/,It Took Just Four Days From Elon Gleefully Admitting He’d Unplugged A Server Rack For Twitter To Have A Major Outage | Techdirt,"I know, I know. Some of the more angry commenters around here keep insisting that I should stop talking about Elon Musk and Twitter, and I want to do exactly that. I planned to do exactly that and …",https://www.techdirt.com/wp-content/themes/techdirt/assets/images/td-rect-logo-white.png,2022-12-29T20:36:56.500665857Z,https://news.ycombinator.com/item?id=34173472
https://www.tbray.org/ongoing/When/202x/2022/12/29/Privacy-is-OK,ongoing by Tim Bray · Privacy Is OK,,,2022-12-29T23:17:45.52413122Z,https://news.ycombinator.com/item?id=34177930
https://arslan.io/2022/12/29/recap-year-2022/,Recap Year 2022,It's been four years since I wrote a recap. I wrote an update about my life two years ago when I left the U.S. and moved back to Turkey. It's a Recap of the years 2019-2020. I would suggest reading that blog post if you haven't yet because some,https://arslan.io/content/images/2022/12/0661E42E-AFE9-4EF3-8F1B-AC387A86A899.jpeg,2022-12-30T04:04:21.897784965Z,
https://statuskuo.substack.com/p/the-downfall-of-andrew-tate-isnt?sd=pf,The Downfall of Andrew Tate Isn’t Just Deliciously Ironic. It’s Also Vitally Important.,"If you’re like many people, the first time you’d ever heard the name Andrew Tate was through reading about climate activist Greta Thunberg’s brutal takedown on Twitter after the former lightweight world kickboxing champion decided rather unwisely to troll her. As it is Schadenfriday, I’ll review the hilariously ironic part of this first before getting into why this actually matters beyond the hellsite of Twitter.","https://substackcdn.com/image/fetch/w_1200,h_600,c_limit,f_jpg,q_auto:good,fl_progressive:steep/https%3A%2F%2Fbucketeer-e05bbc84-baa3-437e-9518-adb32be77984.s3.amazonaws.com%2Fpublic%2Fimages%2Fa7f6db7d-f2fc-4085-9f68-c3c5ba619f17_1862x1046.webp",2022-12-30T20:26:46.17212516Z,
https://www.theverge.com/23513418/bring-back-personal-blogging,Bring back personal blogging - The Verge,"The personal blog built the internet, and maybe it can fix it.",https://cdn.vox-cdn.com/thumbor/WaCKWzh7yeD5hRCCXhEbt-wwSKk=/0x0:2048x1360/1200x628/filters:focal(1024x680:1025x681)/cdn.vox-cdn.com/uploads/chorus_asset/file/3423214/7024888627_3257c520fd_k.0.jpg,2023-01-01T04:29:52.381442569Z,https://news.ycombinator.com/item?id=34197972
https://daniel.haxx.se/blog/2022/12/30/an-m1-for-curl/,An m1 for curl | daniel.haxx.se,,,2023-01-01T19:16:16.416219975Z,https://news.ycombinator.com/item?id=34183020
https://www.dailykos.com/stories/2022/12/31/2137977/-Hidden-Film-History-The-antifa-Casablanca-star-who-defied-Goebbels-for-the-Jewish-woman-he-loved,Hidden Film History: The antifa 'Casablanca' star who defied Goebbels for the Jewish woman he loved,"January 2023 marks the 80th anniversary of the release of the film classic Casablanca. The film had its world premiere at the Hollywood Theatre on Nov. 26, 1942, and was released nationally in the U.S. on Jan. 23, 1943. In real life, Allied forces had...",https://images.dailykos.com/images/1147945/story_image/ConradVeidtinCasablanca.jpg?1672414233,2023-01-01T19:26:32.65341689Z,
https://devlog.hexops.com/2022/2022-closing-thoughts/,2022 Reflecting on a year in life & game development | Hexops' devlog,"2022 ends in an hour, and new opportunities open. I am filled with optimism, pessimism, fear, and excitement. A walking, talking contradiction of life at your service.",https://user-images.githubusercontent.com/3173176/210161169-08829568-8c69-4654-9df1-9d7e3ed9f291.png,2023-01-02T00:34:37.366243192Z,
https://medium.com/@thefatzombi/deploying-a-jekyll-site-to-aws-s3-with-aws-cloudfront-using-github-actions-a9c8b2498960,"Deploying a Jekyll website to AWS S3 with GitHub Actions and AWS CloudFormation | by Fatzombi | Jan, 2023 | Medium","Configure a static website using Jekyll, GitHub Actions, AWS S3, Route 53, Certificate Manager, CloudFront, and CloudFormation.",https://miro.medium.com/max/1200/1*9I6tLbfSvyB8qoS6sdecPA.png,2023-01-02T00:39:24.297698513Z,
https://www.jamesshore.com/v2/projects/testing-without-mocks/testing-without-mocks,James Shore: Testing Without Mocks: A Pattern Language,,,2023-01-02T00:44:47.856253069Z,https://news.ycombinator.com/item?id=34115021
https://www.theguardian.com/us-news/2023/jan/02/kevin-mccarthy-speaker-republicans-hardliners-house,Kevin McCarthy’s speaker bid in balance as effort to placate hardliners flops | Republicans | The Guardian,Republican ‘Never Kevins’ say series of concessions to rightwingers are ‘insufficient’ to secure support,https://i.guim.co.uk/img/media/3536f6276a193c69105a4e0c0949675f27ecc728/0_542_8180_4911/master/8180.jpg?width=1200&height=630&quality=85&auto=format&fit=crop&overlay-align=bottom%2Cleft&overlay-width=100p&overlay-base64=L2ltZy9zdGF0aWMvb3ZlcmxheXMvdGctZGVmYXVsdC5wbmc&enable=upscale&s=b7f5d9596998ec37972dd446b5db5a58,2023-01-02T17:59:55.519699838Z,
https://www.theverge.com/2023/1/2/23531390/samsung-viewfinity-s9-5k-monitor-announced-features,Samsung’s ViewFinity S9 is a stylish 5K display for creative professionals - The Verge,It’s the same size and same resolution as the Studio Display.,https://cdn.vox-cdn.com/thumbor/Jtbob1M2RVP8pW3oMPnwuZ0xruM=/0x0:2040x1264/1200x628/filters:focal(994x541:995x542)/cdn.vox-cdn.com/uploads/chorus_asset/file/24330600/Viewfinity_S9_S90PC_Front_Landscape_w_Camera.jpg,2023-01-02T19:16:20.118513262Z,
https://gist.github.com/jsit/545542b076f559a92ec7ffd4d35c1895,"Mastodon Explained in 100, 200, and 500 Words","Mastodon Explained in 100, 200, and 500 Words. GitHub Gist: instantly share code, notes, and snippets.",https://github.githubassets.com/images/modules/gists/gist-og-image.png,2023-01-02T19:33:40.045722669Z,https://news.ycombinator.com/item?id=34085029
https://dustri.org/b/the-quest-for-a-family-friendly-password-manager.html,The quest for a family-friendly password manager,Personal blog of Julien (jvoisin) Voisin,,2023-01-02T20:51:39.654587152Z,https://news.ycombinator.com/item?id=34219434
https://news.stanford.edu/2021/02/23/four-causes-zoom-fatigue-solutions/,Four causes for ‘Zoom fatigue’ and their solutions | Stanford News,It’s not just Zoom. Popular video chat platforms have design flaws that exhaust the human mind and body. But there are easy ways to mitigate their effects.,https://news.stanford.edu/wp-content/uploads/2021/02/GettyImages-1221478602.jpg,2023-01-02T22:06:49.669210483Z,https://news.ycombinator.com/item?id=26278841
https://www.tbray.org/ongoing/When/202x/2022/12/30/Mastodon-Privacy-and-Search,ongoing by Tim Bray · Private and Public Mastodon,,,2023-01-02T22:36:12.151683305Z,https://news.ycombinator.com/item?id=34221851
https://www.theregister.com/2023/01/01/mastodon_activitypub/,The decentralized technology inside Mastodon • The Register,ActivityPub isn't just what we've been doing over the Christmas break,https://regmedia.co.uk/2022/12/31/shutterstock_mastodon.jpg,2023-01-03T02:11:09.346747388Z,https://news.ycombinator.com/item?id=34206180
https://www.theatlantic.com/technology/archive/2023/01/smart-tvs-sony-lg-cheap/672614/,The Hidden Cost of Cheap TVs - The Atlantic,Screens have gotten inexpensive—and they’re watching you back.,https://cdn.theatlantic.com/thumbor/ZfTufC8-Mf-EZtgPqCwFsaoL7LI=/0x85:3992x2164/1200x625/media/img/mt/2022/12/GettyImages_961717014/original.jpg,2023-01-03T21:19:33.954062878Z,https://news.ycombinator.com/item?id=34235041
https://blog.blankbaby.com/2023/01/replacement-for-dark-sky.html,Replacement for Dark Sky – Blankbaby,"Dark Sky, my weather app of choice for several years, is no more. This is sad, but I’ve done what any sensible person would and downloaded 12 weather apps from the App Store to find a suitable repl…",https://blog.blankbaby.com/wp-content/uploads/2023/01/HeroImageWeatherApps.jpeg,2023-01-03T21:50:28.622236867Z,
https://www.pv-magazine.com/2023/01/02/residential-thermo-acoustic-heat-pump-produces-water-up-to-80-c/,French startup unveils new residential thermo-acoustic heat pump – pv magazine International,Equium has developed a new thermo-acoustic heat pump core that reportedly produces 3 kW to 4 kW of heat for every kilowatt of power it consumes. It says the refrigerant-free device could generate domestic hot water at temperatures of up to 80 C.,https://www.pv-magazine.com/wp-content/uploads/2022/12/EQORE-EQUIUM-1200x1200.png,2023-01-04T01:14:53.812382728Z,https://news.ycombinator.com/item?id=34233719
https://terrateam.io/blog/flying-away-from-aws,Flying away from AWS - Terrateam,Flying away from AWS,https://terrateam.io/og-image.jpg,2023-01-04T01:18:00.777810441Z,https://news.ycombinator.com/item?id=34238150
https://rogerevansonline.com/2012/12/03/bachs-signature/,Bach’s Signature | RogerEvansOnline.com,"There was no end to the ingenuity of Johann Sebastian Bach. If you read this single note with all the clefs and key signatures that he provides, B A C and H all emerge from the puzzle. (Tip of the …",https://rogerevans.files.wordpress.com/2012/12/signature.jpg,2023-01-04T01:19:46.863167453Z,
https://www.thisiscolossal.com/2023/01/spencer-schien-population-maps/,Boldly Contrasted Maps by Spencer Schien Visualize Population Density Data — Colossal,"It's one thing to know that Chicago is the third largest city in the United States, but how can we see it?",https://www.thisiscolossal.com/wp-content/uploads/2022/12/shien-og.jpg,2023-01-04T03:16:07.588309789Z,
