url,title,description,image,date,hnurl
https://www.spoon-tamago.com/toei-project-unseen-maintenance-trains/,Illustrations of ‘Unseen’ Japanese Maintenance Trains that Only Work at Night | Spoon & Tamago,"Japanese trains are renowned for their punctuality, comfort and overall reliability. But part of what makes them so reliable is an ""unseen"" workforce of overnight trains. These trains will be unfamiliar to the everyday rider because they only show themselves after regular service has ended for the d",https://www.spoon-tamago.com/wp-content/uploads/2019/06/project-toei-022-top.jpg,2023-04-07T00:58:46.39183409Z,https://news.ycombinator.com/item?id=35474895
https://9to5mac.com/2023/04/06/apple-store-robbery-bathroom-wall-hole/,Thieves cut a hole in a bathroom wall to steal $500k worth of devices from Apple Store - 9to5Mac,"Apple Stores are no strangers to having products stolen, but usually, thieves are only able to escape with a small...",https://i0.wp.com/9to5mac.com/wp-content/uploads/sites/6/2023/04/apple-store-robbery.jpg?resize=1200%2C628&quality=82&strip=all&ssl=1,2023-04-07T01:21:56.960274714Z,https://news.ycombinator.com/item?id=35472335
https://sixcolors.com/post/2023/04/general-motors-hates-your-iphone/,General Motors hates your iPhone – Six Colors,"As first reported by Reuters, General Motors has decided that the company’s future electric cars will drop support for CarPlay and Android Auto, preferring the company’s own infotainmen…",https://149426355.v2.pressablecdn.com/wp-content/uploads/2023/04/carplaynz-6c.png,2023-04-07T01:35:47.256976501Z,
https://www.vox.com/23055489/irs-automatic-filing-prepopulated-returns,Over 60 million people could have their tax returns automatically done by the IRS - Vox,"""Automatic returns"" could vastly simplify tax season for millions of people.",https://cdn.vox-cdn.com/thumbor/fgIG02aClHYGPmzbFW3joSLt0Wc=/0x363:6125x3570/fit-in/1200x630/cdn.vox-cdn.com/uploads/chorus_asset/file/23438058/1239754955.jpg,2023-04-07T03:18:29.93365056Z,https://news.ycombinator.com/item?id=35476709
https://www.bloomberg.com/features/2023-how-to-beat-roulette-gambler-figures-it-out/?leadSource=uverify%20wall,How to Beat Roulette: One Gambler Figured It Out and Won Big,"For decades, casinos scoffed as mathematicians and physicists devised elaborate systems to take down the house. Then an unassuming Croatian’s winning strategy forever changed the game.",https://assets.bwbx.io/images/users/iqjWHBFdfxIU/iCNdl_VqnIl8/v0/-1x-1.jpg,2023-04-07T16:31:31.473468911Z,
https://9to5mac.com/2023/04/07/ai-cracks-passwords-this-fast-how-to-protect/,"AI cracks passwords this fast, how to protect yourself - 9to5Mac",Along with the positive aspects of the new generative AI services come new risks. One that’s surfaced is an advanced...,https://i0.wp.com/9to5mac.com/wp-content/uploads/sites/6/2023/04/ai-cracks-passwords-this-fast.jpg?resize=1200%2C628&quality=82&strip=all&ssl=1,2023-04-07T21:12:59.264711028Z,
https://9to5mac.com/2023/04/07/rivian-carplay-support/,Here's why Rivian refuses to support CarPlay - 9to5Mac,"CarPlay is available on the vast majority of cars today, including on electric vehicles from the likes of Ford, Polestar,...",https://i0.wp.com/9to5mac.com/wp-content/uploads/sites/6/2023/04/rivian.jpg?resize=1200%2C628&quality=82&strip=all&ssl=1,2023-04-07T21:45:43.384678751Z,https://news.ycombinator.com/item?id=35486465
https://arstechnica.com/information-technology/2023/04/crooks-are-stealing-cars-using-previously-unknown-keyless-can-injection-attacks/,There’s a new form of keyless car theft that works in under 2 minutes | Ars Technica,"As car owners grow hip to one form a theft, crooks are turning to new ones.",https://cdn.arstechnica.net/wp-content/uploads/2023/04/vehicle-theft-760x380.jpg,2023-04-08T03:16:51.520651179Z,https://news.ycombinator.com/item?id=35487867
https://keith-mcnulty.medium.com/heres-how-two-new-orleans-teenagers-found-a-new-proof-of-the-pythagorean-theorem-b4f6e7e9ea2d,"Here’s How Two New Orleans Teenagers Found a New Proof of the Pythagorean Theorem | by Keith McNulty | Apr, 2023 | Medium",An inspirational example of how elementary math is open to everyone,https://miro.medium.com/v2/resize:fit:1200/0*36prYfiJ2G7f3mY4.png,2023-04-09T02:57:10.291342644Z,https://news.ycombinator.com/item?id=35497696
https://tidbits.com/2023/03/29/apple-music-classical-mostly-plays-the-right-chords/,Apple Music Classical (Mostly) Plays the Right Chords - TidBITS,People unfamiliar with classical music who want to discover new music will find the Apple Music Classical app more than sufficient. Classical music fans familiar with the genre and looking for uncommon recordings will find it somewhat frustrating.,https://tidbits.com/wp/../uploads/2023/03/Apple-Music-Classical-Glenn-Gould-album.jpg,2023-04-09T03:14:54.771258358Z,
https://kirkville.com/heres-how-messed-up-apple-music-metadata-is/,Kirkville - Here’s How Messed Up Apple Music Metadata Is,Apple Music’s metadata is messed up.,http://www.kirkville.com/wordpress/wp-content/uploads/sinatra-new.jpeg,2023-04-09T03:17:06.227663851Z,
https://davidisaksson.dev/posts/closing-stale-ssh-connections/,Closing a stale SSH connection | DIDEV,"Suppose you’re connected to a remote host with SSH and after a while the SSH session goes stale. The terminal is unresponsive and no keypress seem to take effect. There might be something with the network, the remote host is restarting or maybe your machine has been in hibernation, there could be multiple reasons for a stale session. The first solution that might come to mind is to just close the terminal emulator and create another one, but there is a better way.",,2023-04-09T21:43:13.44238781Z,https://news.ycombinator.com/item?id=35504402
https://blog.blankbaby.com/2023/04/be-still-my-heart.html,Be still my heart – Blankbaby,"When a part of you is broken for long enough, it feels weird being fixed. I have had a couple of heart arrhythmias for several years. I’m sure I had them for longer than I knew about them, bu…",https://i0.wp.com/blog.blankbaby.com/wp-content/uploads/2023/04/ablatedscott.jpeg?fit=1000%2C1000&ssl=1,2023-04-10T17:02:24.109830136Z,
https://davidmuller.github.io/posts/2023/04/10/how-i-fixed-a-parasitic-drain-in-408-days.html,How I Fixed a Parasitic Drain on my Car in 408 Days | David Muller,How I Fixed a Parasitic Drain on my Car in 408 Days,,2023-04-10T21:34:32.986573103Z,https://news.ycombinator.com/item?id=35513636
https://www.bengreenberg.dev/posts/2023-04-09-github-profile-dynamic-content/,Ben Greenberg | Developer Advocate,Actualizing Developer Happiness,,2023-04-10T21:35:47.594673453Z,https://news.ycombinator.com/item?id=35514799
https://decodebytes.substack.com/p/night-of-the-living-brain-fog-dead,"Night of the living brain fog dead, or how I hacked myself better thanks to open source software.","I had felt tired for such a long time, that I had normalised the whole affair. Every night, the same routine would unfold. I would awaken multiple times for no conceivable reason, feeling irritable and restless, or my compassionate and frequently anxious wife, would rouse me with the words, ""WAKE UP, YOU'RE NOT BREATHING!""","https://substackcdn.com/image/youtube/w_728,c_limit/0SXhAFKWCoY",2023-04-10T21:42:40.983864465Z,https://news.ycombinator.com/item?id=35511047
https://daringfireball.net/2023/04/gm_carplay_iphones,"Daring Fireball: GM, CarPlay, and iPhones","In many ways our phones are our new digital hubs, and CarPlay exemplifies that role.",https://daringfireball.net/graphics/df-square-1024.png,2023-04-11T00:43:01.537867321Z,
https://notes.sibyllekuder.com/get-well-soon/,Get well soon! | elfenbein klaviermusik notes,"People who know that I’ve had hip replacement surgery four week ago keep telling me, Get Well Soon, I hope you recover quickly, etc. The thing is - complete recovery from this kind of surgery can take 6-9 months.",,2023-04-11T00:47:12.687107676Z,
https://itsfoss.com/apt-get-upgrade-vs-dist-upgrade/,What's the difference between apt-get upgrade vs dist-upgrade?,"You’ll often see two of common ways of updating Debian and Ubuntu-based distributions:       * sudo apt-get update && sudo apt-get upgrade  * sudo apt-get update && sudo apt-get dist-upgrade      The apt-get update part updates the local package cache and thus tells your system about the packages that can be upgraded.      However, many Linux",https://itsfoss.com/content/images/wordpress/2022/08/apt-get-upgrade-vs-dist-upgrade.png,2023-04-11T14:03:00.053583315Z,
https://nautil.us/why-is-sea-level-rise-worse-in-some-places-294325/,Why Is Sea Level Rise Worse In Some Places? - Nautilus,"One question for Sönke Dangendorf, a coastal flooding researcher at Tulane University.",https://assets.nautil.us/sites/3/nautilus/Dangendorf_HERO.png?auto=compress&fm=png&ixlib=php-3.3.1,2023-04-11T16:54:50.036637944Z,https://news.ycombinator.com/item?id=35524375
https://andgein.ru/blog/all/20-i-worked-at-google-for-10-days/,I worked at Google for -10 days,It’s the story of how I was laid off from Google before I even started to do my job there. ,https://andgein.ru/blog/pictures/google-layoff.jpeg,2023-04-11T16:58:14.492543715Z,https://news.ycombinator.com/item?id=35525294
https://www.jetpens.com/blog/The-42-Best-Pens-for-2023-Gel-Ballpoint-Rollerball-and-Fountain-Pens/pt/974,"The 42 Best Pens for 2023: Gel, Ballpoint, Rollerball, and Fountain Pens | JetPens","We draw on years of testing to crown the best beginner fountain pen, best gel pen, best pen for note-taking, and more.  Each recommendation includes links to related guides so that you can evaluate the competition for yourself.",,2023-04-12T00:56:36.056123845Z,https://news.ycombinator.com/item?id=35527873
https://randalolson.com/2016/07/30/the-optimal-u-s-national-parks-centennial-road-trip/,The Optimal U.S. National Parks Centennial Road Trip | Dr. Randal S. Olson,Randy Olson shows how to create an optimized road trip that visits the U.S. National Parks.,/assets/2016/07/800px-USA_09847_Grand_Canyon_Luca_Galuzzi_2007.jpg,2023-04-12T02:30:36.861247812Z,
https://maciekpalmowski.dev/buying-a-bicycle-using-playwright/,Buying a bicycle using Playwright | maciek palmowski,"There is a time in every cyclist's life when they decide to change their bike. This year I felt it was my turn to do so. That's why I used e2e testing,...",https://maciekpalmowski.dev/img/containers/assets/arts/playwright/post-cover--twitter-%281%29.png/1d4d2b1a0667300e6bfa05775ea9cee0.png,2023-04-12T16:28:09.904606264Z,
https://www.wbur.org/npr/1169269161/npr-leaves-twitter-government-funded-media-label,NPR quits Twitter after being falsely labeled as 'state-affiliated media' | WBUR,NPR's official Twitter feeds have gone silent. The news organization cites the social media platform's decision to question NPR's editorial independence through a series of inaccurate labels.,http://media.npr.org/assets/img/2023/04/11/ap34053526436_custom-00239ba039420b5a46f629065ff31a85e96392f8.jpg?s=5,2023-04-12T21:18:38.88593957Z,https://news.ycombinator.com/item?id=35539280
https://www.theverge.com/23653556/tweetbot-twitter-api-elon-musk-mastodon,How Tweetbot died (and lived again) - The Verge,"When Twitter shut off API access, third-party apps were left high and dry. One app chose to pivot to become a Mastodon app.",https://cdn.vox-cdn.com/thumbor/5h8fonOvTT8-OGiWTKbXzxIFUN4=/0x0:3000x2000/1200x628/filters:focal(1500x1000:1501x1001)/cdn.vox-cdn.com/uploads/chorus_asset/file/24539832/P12_RIP_Tweetbot_236587.jpg,2023-04-12T22:31:06.67585399Z,https://news.ycombinator.com/item?id=35486014
https://kottke.org/23/04/customize-your-airpods-pro-for-even-better-sound,Customize Your AirPods Pro for Even Better Sound,"Earlier today, I posted a Quick Link to the 2nd-generation AirPods Pro on Amazon because they were $50 off, a good deal for an ite",https://img.youtube.com/vi/f3DfJxvkN-8/0.jpg,2023-04-13T00:30:10.855795258Z,
https://tailscale.dev/blog/darwin-spelunking,Improving Tailscale via Apple’s open source,Spelunking through the Darwin kernel and userland helps Tailscale work better on macOS and iOS.,https://tailscale.dev/images/darwin-spelunking/social.png,2023-04-13T22:06:48.642533069Z,https://news.ycombinator.com/item?id=35559124
https://amitp.blogspot.com/2023/04/mac-keyboard-with-hidutil.html,Amit's Thoughts: Mac keyboard with hidutil," [Updated 13-Apr-2023 with some of the background context and some things I learned from hackernews ]    On my Mac, I've used KeyRemap4Macbo...",,2023-04-13T22:12:11.541331758Z,https://news.ycombinator.com/item?id=35555475
https://hackerstations.com/setups/mike_mcquaid/,"Mike McQuaid's clean, ergonomic setup in Edinburgh, Scotland | Hacker Stations","Hi! Tell us about who you are and what you do Hi! I’m Mike McQuaid: I’m the Homebrew project leader and have maintained the project for 14 years I’m the CTO and cofounder of Raise.dev I recently left my job as a Principal Engineer at GitHub where I worked for 10 (calendar) years I’ve worked from home(s) for 14 years, mostly for US-based companies. What is your hardware setup? My daily driver is a 16” 2021 M1 Max MacBook Pro.",https://hackerstations.com/setups/mike_mcquaid/images/cover.jpeg,2023-04-14T01:04:57.805815627Z,
https://www.davidrevoy.com/article964/goodbye-blue-bird,Goodbye Blue Bird. - David Revoy,"Website of David Revoy (aka Deevad), artist and instructor using only Free/Libre and Open-Source software since 2009.",https://www.davidrevoy.com/data/images/blog/2023/2023-04-13_goodbye-blue-bird.jpg,2023-04-14T01:17:31.70340888Z,
https://missionlocal.org/2023/04/bob-lee-killing-arrest-made-san-francisco/,Arrest made in SF killing of Bob Lee — tech exec's alleged killer also worked in tech - Mission Local,"Mission Local is told that San Francisco police this morning arrested a suspect, Nima Momeni, in the April 4 killing of tech exec Bob Lee.",https://missionloca.s3.amazonaws.com/mission/wp-content/uploads/2023/04/Screen-Shot-2023-04-07-at-2.57.41-PM.png,2023-04-14T01:56:40.07973168Z,https://news.ycombinator.com/item?id=35555525
https://www.cbc.ca/news/world/spain-cave-500-days-beatriz-flamini-1.6810428,Spanish climber emerges after 500 days in cave | CBC News,A 50-year-old Spanish extreme athlete who spent 500 days living 70 metres deep in a cave outside Granada with no contact with the outside world has told how the time flew by.,https://i.cbc.ca/1.6810438.1681475875!/fileImage/httpImage/image.JPG_gen/derivatives/16x9_620/spain-cave-record.JPG,2023-04-14T21:06:07.158836072Z,https://news.ycombinator.com/item?id=35571481
https://www.techdirt.com/2023/04/14/substack-ceo-chris-best-doesnt-realize-hes-just-become-the-nazi-bar/,Substack CEO Chris Best Doesn’t Realize He’s Just Become The Nazi Bar | Techdirt,"I get it. I totally get it. Every tech dude comes along and has this thought: “hey, we’ll be the free speech social media site. We won’t do any moderation beyond what’s required.” Even Twitter init…",https://www.techdirt.com/wp-content/themes/techdirt/assets/images/td-rect-logo-white.png,2023-04-14T21:52:50.870936671Z,https://news.ycombinator.com/item?id=35573470
https://www.thecut.com/2023/04/panic-attack-how-to-help.html,How Not to Make It Worse During a Panic Attack,"You can’t stop it, but you can provide comfort.",https://pyxis.nymag.com/v1/imgs/476/d20/6087c7b0e1de2e1972cce1927ee5d35401-Panic-Attack.1x.rsocial.w1200.jpg,2023-04-15T00:09:07.577161596Z,
https://www.freep.com/story/money/cars/general-motors/2023/04/14/gm-apple-carplay-android-auto-ford/70100598007/,"GM’s decision to ditch Apple CarPlay, Android Auto sparks backlash",GM defends its move to drop Apple CarPlay and Android Auto despite consumer backlash. Ford vows to keep it. Here's the story behind each decision.,"https://www.gannett-cdn.com/presto/2023/04/11/PDTF/df8d4169-1ca0-4ce7-8db0-cccff61a7f98-Will_Lindley.jpg?crop=3023,1700,x0,y1008&width=3023&height=1700&format=pjpg&auto=webp",2023-04-15T02:11:14.571956723Z,https://news.ycombinator.com/item?id=35573345
https://www.macrumors.com/2023/04/15/kroger-fred-meyer-apple-pay/?utm_source=dlvr.it&utm_medium=mastodon,Kroger Begins Accepting Apple Pay After Years of Holding Out - MacRumors,"Kroger this week began accepting Apple Pay and other contactless payment methods at select locations in Kentucky and Ohio, allowing customers to tap...",https://images.macrumors.com/t/qp4GMKfm1XMX6n6l7Rghk_59uMA=/1600x/article-new/2023/04/Apple-Pay-Kroger.jpeg,2023-04-15T17:06:27.907557766Z,
https://jaylittle.com/post/view/2019/12/why-i-cant-stfu-and-just-code-a-solution-to-your-problems,Jay Little - Software Obsessionist - Why I Can't STFU And Just Code A Solution To Your Problems,"So over the years I've had a number of people tell me that I tend to focus on the negative aspects rather than the positive aspects of situations.  This feedback has been relayed to me on both professional and personal levels.  Let me tell you: That this is absolutely the case.  However I don't see it as a failing so much as an asset.  The purpose of today's post is to both delve into why I feel this way and why clients, co-workers and compatriots feel the way they do.",https://jaylittle.com/images/system/danboard_tip_toeing.webp,2023-04-15T17:11:25.212978425Z,
https://jaylittle.com/post/view/2023/4/low-code-software-development-is-a-lie,Jay Little - Software Obsessionist - Low Code Software Development Is A Lie,I've been writing custom software for a long time and one of the things that annoys me most is when a client adopts the position that there is a silver bullet which will reduce or remove the inherent complexity of this task.  This happens more often than you'd think and guess what?  They are almost always wrong.,https://jaylittle.com/images/system/danboard_tip_toeing.webp,2023-04-15T17:15:48.036462303Z,https://news.ycombinator.com/item?id=35578240
https://cabel.com/2023/04/03/lotte-hotel-little-secret/,Lotte Hotel Little Secret – cabel.com,"We recently stayed a night at a Lotte Hotel in Seattle. I must admit with some shame that I only thought of Lotte as just a candy company — but they are, in fact, a multinational conglomerate, and …",https://i0.wp.com/cabel.com/wp-content/uploads/2023/04/IMG_1325.jpeg?fit=1200%2C900&ssl=1,2023-04-15T20:52:24.033374607Z,https://news.ycombinator.com/item?id=35582849
https://hellgatenyc.com/why-is-airport-turkey-sandwich-expensive,Why Does a Plastic-Wrapped Turkey Sandwich Cost $15 at the Airport? - Hell Gate,"We filed a public records request, but the Port Authority is treating airport pricing like a state secret.",https://lede-admin.hellgatenyc.com/wp-content/uploads/sites/43/2023/04/Turkeysand.jpg,2023-04-15T21:03:03.547175592Z,https://news.ycombinator.com/item?id=35580847
https://www.pewresearch.org/fact-tank/2023/04/06/gun-deaths-among-us-kids-rose-50-percent-in-two-years/,Gun deaths among U.S. kids rose 50% from 2019 to 2021 | Pew Research Center,"In 2021, there were 2,590 gun deaths among U.S. children and teens under the age of 18, up from 1,732 in 2019.",https://www.pewresearch.org/wp-content/uploads/2023/04/SR_23.03.30_KidsGuns_feature.png?w=1200&h=628&crop=1,2023-04-16T01:46:34.774855795Z,
https://paulstamatiou.com/digital-clutter/,Digital clutter — PaulStamatiou.com,"Learning to let go and stop hoarding terabytes: Sharing my journey of downsizing my digital storage, letting go of terabytes of data, and moving away from a NAS setup....",,2023-04-16T02:44:47.692798053Z,https://news.ycombinator.com/item?id=35584866
https://99percentinvisible.org/episode/de-fiets-is-niets/,De Fiets is Niets - 99% Invisible,"Today the Netherlands has a reputation as a kind of bicycling paradise. Dutch people own more bicycles per capita than any other place in the world. The country has more than 20,000 miles of dedicated cycling paths. International policymakers make pilgrimages to the Netherlands to learn how to create good bike infrastructure. But none of",https://99percentinvisible.org/app/uploads/2023/03/canal-cycle-728x546.jpg,2023-04-16T13:27:05.196641613Z,
https://www.theguardian.com/business/2023/apr/06/forbes-30-under-30-tech-finance-prison,30 under 30-year sentences: why so many of Forbes’ young heroes face jail | Arwa Mahdawi | The Guardian,"Ex-CEO Charlie Javice, 31, is just the latest from the magazine’s list to see criminal charges",https://i.guim.co.uk/img/media/55bdaee5059a9abede2f500e4c4ac792b6623454/714_136_4625_2775/master/4625.jpg?width=1200&height=630&quality=85&auto=format&fit=crop&overlay-align=bottom%2Cleft&overlay-width=100p&overlay-base64=L2ltZy9zdGF0aWMvb3ZlcmxheXMvdGctb3BpbmlvbnMucG5n&enable=upscale&s=7f52b2e8af9b0e8ddba8f4d87b53b114,2023-04-16T13:30:10.884838358Z,https://news.ycombinator.com/item?id=35478675
https://benjamincongdon.me/blog/2023/04/15/The-Soul-of-an-Old-Machine/,The Soul of an Old Machine | Ben Congdon,On retiring my trusty 2014 MacBook Pro,https://benjamincongdon.me/blog/2023/04/15/The-Soul-of-an-Old-Machine/cover.jpg,2023-04-16T13:47:52.964391505Z,https://news.ycombinator.com/item?id=35584736
https://xenodium.com/my-emacs-eye-candy/,My Emacs eye candy,,,2023-04-16T13:50:26.732500085Z,https://news.ycombinator.com/item?id=35589471
https://registerspill.thorstenball.com/p/a-series-of-ever-bigger-problems?utm_source=substack&utm_medium=email,A series of ever-bigger problems - by Thorsten Ball,Thoughts on growing as a software engineer,"https://substackcdn.com/image/fetch/f_auto,q_auto:best,fl_progressive:steep/https%3A%2F%2Fregisterspill.thorstenball.com%2Ftwitter%2Fsubscribe-card.jpg%3Fv%3D2104743863%26version%3D9",2023-04-16T14:02:01.967987922Z,
https://blog.nelhage.com/post/efficiency-vs-resiliency/,Efficiency trades off against resiliency - Made of Bugs,,,2023-04-16T17:51:15.730805099Z,https://news.ycombinator.com/item?id=35586607
https://terikanefield.com/a-firehose-of-insanity-and-the-republican-cycle-of-radicalization/,A Firehose of Insanity and The Republican Cycle of Radicalization - Teri Kanefield,"There was an explosion of news this week with a theme: The increasing radicalization of the Republican Party. First, we have the abortion pill mifepristone debacle in which a federal judge in Texas attempted to outlaw mifepristone for the entire nation. Here’s the timeline (I find that a bullet point timeline is the best tool … A Firehose of Insanity and The Republican Cycle of Radicalization Read More »",https://terikanefield.com/wp-content/uploads/2023/04/RepublicanCrazies.jpg,2023-04-16T18:28:13.037455821Z,
https://www.macrumors.com/2023/04/16/new-macbooks-at-wwdc-gurman/?utm_source=dlvr.it&utm_medium=mastodon,Gurman: New MacBooks to Be Announced at WWDC in June - MacRumors,"Apple is working on a larger 15-inch MacBook Air, an updated 13-inch MacBook Air, and an updated 13-inch MacBook Pro, and at least some of these new...",https://images.macrumors.com/t/9Jk4bQyyVbFsigZE7SgmTZsQOCE=/2500x/article-new/2022/06/MacBook-Air-Multiple-Sizes-Feature.jpg,2023-04-16T18:36:23.53116474Z,
https://www.frontiersin.org/articles/10.3389/fimmu.2023.1150105/full,Frontiers | Hypothesis: inflammatory acid-base disruption underpins Long Covid,"The mechanism of Long Covid (Post-Acute Sequelae of COVID-19; PASC) is currently unknown, with no validated diagnostics or therapeutics. SARS-CoV-2 can cause disseminated infections that result in multi-system tissue damage, dysregulated inflammation, and cellular metabolic disruptions. The tissue damage and inflammation has been shown to impair microvascular circulation, resulting in hypoxia, which coupled with virally-induced metabolic reprogramming, increases cellular anaerobic respiration. Both acute and PASC patients show systemic dysregulation of multiple markers of the acid-base balance. Based on these data, we hypothesize that the shift to anaerobic respiration causes an acid-base disruption that can affect every organ system and underpins the symptoms of PASC. This hypothesis can be tested by longitudinally evaluating acid-base markers in PASC patients and controls over the course of a month. If our hypothesis is correct, this could have significant implications for our understanding of PASC and our ability to develop effective diagnostic and therapeutic approaches. ",https://www.frontiersin.org/files/MyHome%20Article%20Library/1150105/1150105_Thumb_400.jpg,2023-04-16T19:45:10.246678267Z,https://news.ycombinator.com/item?id=35582395
https://adriano.fyi/post/2023/2023-04-16-att-traffic-shaping-makes-websites-unusable/,AT&T Wireless traffic shaping apparently making some websites unusable - Adriano Caloiaro,"When I’m living in my RV, wireless service providers are my primary source of connectivity. So when either AT&T or Verizon make major changes, I take notice. I recently noticed that multiple websites are quite slow when browsing with my AT&T business plan, listed in AT&T Premier (business account management UI) as “Wireless Broadband Ultra for Router or Hotspt (sic)”. This is an “unlimited” 100Mbit plan with 50GB for Business Fast Track (prioritized) data.",,2023-04-17T00:53:55.56296677Z,https://news.ycombinator.com/item?id=35592607
https://www.tbray.org/ongoing/When/202x/2023/04/15/Working-Well,ongoing by Tim Bray · Working Well,,,2023-04-17T01:11:49.245559995Z,
https://zackproser.com/blog/maintaining-this-site-fucking-sucks,Zachary Proser,Software engineer and artist,,2023-04-17T13:05:56.914425604Z,https://news.ycombinator.com/item?id=35598400
https://louwrentius.com/i-made-my-blog-solar-powered-then-things-escalated.html,"I made my blog solar-powered, then things escalated",,,2023-04-17T13:08:31.123765676Z,https://news.ycombinator.com/item?id=35596959
https://utcc.utoronto.ca/~cks/space/blog/tech/OpenSSHVersusSSH,Chris's Wiki :: blog/tech/OpenSSHVersusSSH,,,2023-04-17T19:13:49.312167654Z,https://news.ycombinator.com/item?id=35587981
