url,title,description,image,date,hnurl
https://codeburst.io/using-github-actions-with-repository-dispatch-event-c113a45b3948,Using Github Actions with Repository Dispatch Event | by Sanjar Kairosh | codeburst,"If you ever set up a Github Actions workflow on a repository, you will recognize the YAML file that executes steps upon any code you push…",https://miro.medium.com/max/1200/1*JdXNjkwq9R5hyZuzWGDF_Q.jpeg,2022-09-11T02:17:15.190457149Z,
https://www.ethanhein.com/wp/2022/why-are-d-sharp-and-e-flat-considered-to-be-two-different-notes/,Why are D-sharp and E-flat considered to be two different notes | The Ethan Hein Blog,"Why do the black keys on the piano each have two different names? If the posts on r/musictheory are any indication, this is a persistent point of confusion, especially when music theory teachers ge…",http://www.ethanhein.com/wp/wp-content/uploads/2016/02/theory-for-producers-black-keys-1024x455.png,2022-09-11T02:25:15.90238247Z,https://news.ycombinator.com/item?id=32626218
https://zwischenzugs.com/2022/08/08/who-should-write-the-terraform/,“Who Should Write the Terraform?” – zwischenzugs,"The Problem Working in Cloud Native consulting, I’m often asked about who should do various bits of ‘the platform work’. I’m asked this in various forms, and at various leve…",https://zwischenzugs.files.wordpress.com/2022/08/head_shot.jpg,2022-09-11T02:26:13.967014932Z,https://news.ycombinator.com/item?id=32396892
https://www.aitchisoncellos.com/cello-bridge-design/,Cello bridge design - Aitchison & Mnatzaganian Cello Specialists,Cello bridge design is a subtle art. We explore the qualities of the two most common designs: the French and Belgian bridge.,https://i1.wp.com/www.aitchisoncellos.com/wp-content/uploads/2013/10/Rock-1.jpg?fit=1212%2C1478&ssl=1,2022-09-11T02:27:32.635750302Z,
https://userpilot.com/blog/okrs-vs-kpis/,OKRs vs KPIs - Understanding Measurements for your SaaS Product,OKRs vs KPIs - learn how to measure success the right way for your SaaS product from a business perspective - with examples!,https://blog-static.userpilot.com/blog/wp-content/uploads/2021/10/OKR-vs-KPI_e95eaa3396450c06f369d3a638eab958_2000.png,2022-09-11T12:57:56.720161406Z,https://news.ycombinator.com/item?id=29130039
https://www.joshwcomeau.com/blog/how-to-learn-stuff-quickly/#%2F%2F%2F%2F%2F%2F/,How To Learn Stuff Quickly,"As software developers, we're always learning new things; it's practically the whole gig! If we can learn to quickly pick up new languages/frameworks/tools, we'll become so much more effective at our job. It's sort of a superpower.",https://www.joshwcomeau.com/images/og-how-to-learn-stuff-quickly.png,2022-09-11T13:00:41.433279873Z,https://news.ycombinator.com/item?id=29116026
https://riskledger.com/blog/git-basics-at-risk-ledger/,Git Techniques at Risk Ledger - Risk Ledger,A deep dive into common Git techniques our Product Engineers use at Risk Ledger.,https://riskledger-website-media-uploads.s3-eu-west-1.amazonaws.com/blog-git-techniques-1.jpg,2022-09-11T13:02:43.811449396Z,
https://andregarzia.com/2021/04/writing-a-technical-book.html,Writing a Technical Book • AndreGarzia.com,AndreGarzia.com website,,2022-09-11T16:43:13.785309471Z,https://news.ycombinator.com/item?id=27412287
https://psyche.co/guides/how-to-rest-well-and-enjoy-a-more-creative-sustainable-life,How to rest well | Psyche Guides,"Taking a break isn’t lazy – learning to recharge is a skill that will allow you to enjoy a more creative, sustainable life",https://nu.aeon.co/images/743d6f3b-f77b-43f9-bd6c-fe4a7a9c25dd/1500x1500.jpg,2022-09-11T16:44:15.207939222Z,https://news.ycombinator.com/item?id=29413754
https://arslan.io/2019/07/03/how-to-write-idempotent-bash-scripts/,How to write idempotent Bash scripts · Fatih Arslan,,,2022-09-11T16:47:16.779156771Z,https://news.ycombinator.com/item?id=20375197
https://www.trickster.dev/post/decrypting-your-own-https-traffic-with-wireshark/,Decrypting your own HTTPS traffic with Wireshark – Trickster Dev,"Code level discussion of web scraping, gray hat automation, growth hacking and bounty hunting",,2022-09-11T16:52:58.84375765Z,https://news.ycombinator.com/item?id=30743141
https://notes.eatonphil.com/handling-email-from-gmail-smtp-protocol-basics.html,SMTP protocol basics from scratch in Go: receiving email from Gmail | notes.eatonphil.com,SMTP protocol basics from scratch in Go: receiving email from Gmail,,2022-09-11T16:53:54.891579576Z,https://news.ycombinator.com/item?id=30973460
https://8thlight.com/blog/emmanuel-byrd/2022/05/19/well-thought-project-layout-design-for-a-golang-backend.html?utm_medium=email&utm_source=topic+optin&utm_campaign=awareness&utm_content=20220604+prog+nl&mkt_tok=MTA3LUZNUy0wNzAAAAGEzjUxXUankGNL6CUEkfYFxIpsqVmbmR3Pfl-rk6xTBFpl_Y21FtOYP-G3BBJ5x6utUrB8_pzudtSWY_0rLkQbN3W9o_Lb9CG32qjMXO4Qt22-iA,How To Bootstrap A Quality Golang Backend | 8th Light,"Building a Golang project from scratch requires making some important decisions that will shape the future of the project, providing a scaffolding for yourself and future team members to follow when scaling the codebase. When...",https://8thlight.com/blog/assets/logos/logo-dark-5517382dc86727b20a188a859b388c914609d0e449ed061b39fafe2495fed8c1.png,2022-09-11T16:58:42.789911054Z,
https://smackeyacky.blogspot.com/2022/07/tailscale-ate-my-network-and-i-love-it.html,Tailscale ate my network (and I love it),"No matter where you go, there you are  If you're like me, you travel occasionally.  Access to your office from home, or from an airport loun...",https://blogger.googleusercontent.com/img/b/R29vZ2xl/AVvXsEjjxvBCfffZvQvvCwa64KzoqRe_-poMIZNAxVJ-9zDRAwMh_QJ4qub7vvCkRmHrTZg3yjOsvTOXPb38omgp30idItT48efHxOn-QK5x4YjwujNMwT4RR4kZ-4Mg9A09xgOtjt-hsP--6WYLXRkfEKDJB7fzA-C2O-paU5rS44QSyzbKJx6Gzir6rz5p2g/w1200-h630-p-k-no-nu/Screenshot%20from%202022-07-02%2013-17-51.png,2022-09-11T17:00:32.485275318Z,https://news.ycombinator.com/item?id=31955970
https://documentation.divio.com/,Documentation System,,,2022-09-11T17:01:25.846849108Z,https://news.ycombinator.com/item?id=26002656
https://gist.github.com/pudquick/29bc95b6c49703992981864e48f8e341,"Lightly ""sandboxed"" homebrew on macOS","Lightly ""sandboxed"" homebrew on macOS. GitHub Gist: instantly share code, notes, and snippets.",https://github.githubassets.com/images/modules/gists/gist-og-image.png,2022-09-11T17:02:59.849510671Z,https://news.ycombinator.com/item?id=32704442
https://luisartola.com/framework-laptop-with-ubuntu-review/,Framework Laptop with Ubuntu Review,I built my own laptop over the holiday break and it’s a developer’s dream come true. I took a chance and ordered a Framework Laptop DIY Edition. I’m so glad I did. The Framework is an excellent platform to customize and build a very capable and stable Linux machine for development. Here’s what I love about it and things that could be better.,,2022-09-12T12:29:51.82296792Z,https://news.ycombinator.com/item?id=29806430
https://www.edwinwenink.xyz/posts/42-vim_notetaking/,Building a Note-taking System with Vanilla Vim,,,2022-09-12T13:03:21.974853112Z,
https://medium.com/@rebecca9941/the-zettelkasten-method-examples-to-help-you-get-started-8f8a44fa9ae6,The Zettelkasten Method: Examples to help you get started. | by Rebecca Williams | Medium,"Writing your first Zettelkasten note is intimidating. Most of the resources on Zettelkasten are principle-based, with few examples of how…",https://miro.medium.com/max/1200/1*6W2o5wqPUwsaQWnuCZcqIw.png,2022-09-12T13:09:34.355847075Z,
https://mentalpivot.com/bear-app-a-solid-zettelkasten-solution-for-ios-users/,Bear App: A Solid Zettelkasten Solution for iOS Users — Mental Pivot,"I’ve used The Archive for the past three years to maintain my zettelkasten (notes archive). It’s a well-designed app with a specific feature-set optimized for the zettelkasten note-taking system. Unfortunately, The Archive is only available for MacOS. I recently purchased an iPad Pro with a Magic Keyboard to",,2022-09-12T13:18:41.561491668Z,
https://ciechanow.ski/mechanical-watch/,Mechanical Watch – Bartosz Ciechanowski,Interactive article explaining how a mechanical watch works.,https://ciechanow.ski/images/og/watch.png,2022-09-12T13:33:15.377462252Z,https://news.ycombinator.com/item?id=31261533
https://www.gq.com/story/the-frontline-chef-jose-andres,Cooking on the Frontlines with Chef José Andrés | GQ,"He became a star feeding the fortunate, and a saint feeding the unfortunate. We followed Andrés from his operations on the Ukraine border to his kitchens in Washington, D.C.—and found something much more complex and interesting than a mere saint.","https://media.gq.com/photos/6261a60aaeb70c7dc30ced2f/16:9/w_1280,c_limit/joeandres-16x9.jpg",2022-09-12T13:34:05.895827229Z,
https://kansasreflector.com/2022/09/13/emporia-state-university-is-about-to-suspend-tenure-heres-why-you-should-care/,Emporia State University is about to suspend tenure. Here's why you should care. - Kansas Reflector,"A plan allowing Emporia State University to fire tenured faculty will likely be approved soon, at immense cost to students and institution.",https://kansasreflector.com/wp-content/uploads/2022/06/kenhush2-scaled.jpg,2022-09-13T21:29:04.955569244Z,
https://calebhearth.com/sign-git-with-ssh,Signing Git Commits with Your SSH Key,"You may already be signing your Git commits with a GPG key, but as of today you can instead choose to sign with your SSH key! Signing in SSH is a relatively new feature that lets you use your...</p>",,2022-09-14T01:11:07.296068723Z,https://news.ycombinator.com/item?id=29234817
https://www.theguardian.com/australia-news/2022/sep/13/step-on-it-walking-is-good-for-health-but-walking-faster-is-even-better-study-finds,"Step on it! Walking is good for health but walking faster is even better, study finds | Health | The Guardian","Walking briskly is beneficial for all health outcomes including dementia, heart disease, cancer and death",https://i.guim.co.uk/img/media/e84306ad408ec75e6f6b4478fdc110f88f179b11/599_830_4462_2677/master/4462.jpg?width=1200&height=630&quality=85&auto=format&fit=crop&overlay-align=bottom%2Cleft&overlay-width=100p&overlay-base64=L2ltZy9zdGF0aWMvb3ZlcmxheXMvdGctZGVmYXVsdC5wbmc&enable=upscale&s=b7977ccce01e1b0ec7df3845b642b47e,2022-09-15T15:49:00.832348072Z,https://news.ycombinator.com/item?id=32851591
https://cloud.google.com/blog/products/application-modernization/why-david-yach-loves-go,Why David Yach Loves Go | Google Cloud Blog,"Learn all the reasons David Yach, industry veteran and Director of Engineering at Google Cloud, loves to use Go for software development.",https://cloud.google.com/blog/static/assets/GCP_Twitter_Card-2000×1000.png,2022-09-16T18:06:22.343750961Z,https://news.ycombinator.com/item?id=32816420
https://daringfireball.net/2022/09/the_iphones_14_pro,Daring Fireball: The iPhones 14 Pro (and iPhones 14),"There are two super interesting innovations with the iPhone 14 Pro and Pro Max. There aren’t any interesting innovations with the iPhone 14 or 14 Plus — which fact itself is actually pretty interesting, strategically.",https://daringfireball.net/graphics/df-square-1024.png,2022-09-17T01:25:27.908991103Z,https://news.ycombinator.com/item?id=32868875
https://www.theatlantic.com/magazine/archive/2022/10/gen-z-handwriting-teaching-cursive-history/671246/,Gen Z Never Learned to Read Cursive - The Atlantic,How will they interpret the past?,https://cdn.theatlantic.com/thumbor/cs8ZVmT1Q_jhWppWfopUHfFs-a4=/0x43:2000x1085/1200x625/media/img/2022/09/1022_CC_Faust/original.jpg,2022-09-18T18:02:02.693981434Z,https://news.ycombinator.com/item?id=32884213
https://eli.thegreenplace.net/2022/basic-go-tooling-for-generics/,Basic Go tooling for generics - Eli Bendersky's website,,,2022-09-19T01:08:29.041391384Z,https://news.ycombinator.com/item?id=32878320
https://artemis.sh/2022/09/18/wayland-from-an-x-apologist.html,An X11 Apologist Tries Wayland,"I think it’s only fair to call me an X apologist. I get incredibly frustrated when people talk about dropping support for X11. I fight back against the notion that some day X11 will be dead and unmaintained, a curiosity of a time before. I’ve spoken to people in my circles at-length about the accessibility tools that Wayland simply hasn’t been capable of supporting that X11 has. A lot of times, I’ve ended this conversation with “Maybe 5 years from now it’ll be good”. Well it’s 5 years in since I first said those words, and you know what, I’m actually pleasantly surprised.",,2022-09-19T12:32:30.578856472Z,https://news.ycombinator.com/item?id=32891313
https://popehat.substack.com/p/a-farewell-to-a-friend?utm_source=email,A Farewell To A Friend - by Ken White - The Popehat Report,"Patrick, Co-Blogger and Has Passed","https://substackcdn.com/image/fetch/w_256,c_limit,f_auto,q_auto:good,fl_progressive:steep/https%3A%2F%2Fbucketeer-e05bbc84-baa3-437e-9518-adb32be77984.s3.amazonaws.com%2Fpublic%2Fimages%2Fd6d0f415-4618-48a1-883f-f5c2087af66c_240x240.png",2022-09-20T00:09:00.157647824Z,
https://mainichi.jp/english/articles/20220916/p2a/00m/0sc/017000c,Unique 2-in-1 calculator app adds up to surprise hit for retired engineer in Japan - The Mainichi,"TOKYO -- A 63-year-old man in Japan who is an avid iPhone user has dedicated some of his post-retirement years to developing a popular, unique app tha",https://cdn.mainichi.jp/vol1/2022/09/16/20220916p2a00m0sc014000p/0c10.jpg?1,2022-09-20T01:36:00.652791782Z,https://news.ycombinator.com/item?id=32902520
https://www.scientificamerican.com/article/why-kids-are-afraid-to-ask-for-help/,Why Kids Are Afraid to Ask for Help - Scientific American,Children as young as seven years old may hesitate to ask questions in school because they worry classmates will think they are &ldquo;stupid&rdquo;,https://static.scientificamerican.com/sciam/cache/file/B58C3FB5-0EEB-46CB-8FDA42CA0C109AA1.jpeg,2022-09-20T01:37:20.543658331Z,https://news.ycombinator.com/item?id=32899644
https://www.smh.com.au/world/asia/chinese-scientists-develop-mask-that-detects-covid-in-the-air-20220920-p5bjeq.html,COVID: Chinese scientists develop mask that detects the virus,"A sensor built into a mask was able to detect the COVID-19, H5N1 and H1N1 influenza viruses in the air within 10 minutes and send notifications to a device, according to the study led by six scientists working with Tongji University in Shanghai.",https://static.ffx.io/images/$zoom_1.967%2C$multiply_0.7554%2C$ratio_1.777778%2C$width_1059%2C$x_0%2C$y_45/t_crop_custom/q_86%2Cf_auto/t_smh_no_label_no_age_social_wm/778df4b1538acdc8342ab5b81d835cc90e0a8691,2022-09-20T02:09:46.622556146Z,
https://bryce.vc/post/64889707700/most-people-wont,BRYCE DOT VC,"From an interview with designer/artist/soul searcher Elle Luna: So I was using Uber all the time in San Francisco, even though I hated the design. And then I went to the Crunchies awards ceremony and...",,2022-09-20T12:21:23.98348876Z,https://news.ycombinator.com/item?id=32909152
https://iximiuz.com/en/posts/devops-sre-and-platform-engineering/,"DevOps, SRE, and Platform Engineering","Sharing my understanding of DevOps, SRE, and Platform Engineering based on the first-hand experience in SRE and PE domains.",https://iximiuz.com/img/avatar-280.jpeg,2022-09-20T13:19:37.584310527Z,https://news.ycombinator.com/item?id=28137852
https://www.ctrl.blog/entry/cloudflare-ip-blockade.html,You don’t want to be on Cloudflare’s naughty list | Ctrl blog,"My home IP ended up on Cloudflare’s naughty list for six days. Most websites and many apps loaded slowly, partially, or not at all. Just had to wait it out.",https://www.ctrl.blog/media/hero/cloudflare-ray-security-check.1280x720.png,2022-09-20T16:31:22.626386933Z,https://news.ycombinator.com/item?id=32912075
https://www.timothyrice.org/icecreamsalt/,Thermodynamics of Rock Salt and Ice Cream - Timothy Rice,Why do we salt the ice when making ice cream?,,2022-09-21T21:57:15.978110358Z,https://news.ycombinator.com/item?id=32929126
https://daringfireball.net/2022/09/apple_watch_ultra,Daring Fireball: Apple Watch Ultra,It *almost* feels more like having an adorable little iPhone Nano strapped to my wrist than a huge Apple Watch.,https://daringfireball.net/graphics/df-square-1024.png,2022-09-22T00:53:01.045552412Z,https://news.ycombinator.com/item?id=32931895
https://rsdlt.github.io/posts/rust-nvim-ide-guide-walkthrough-development-debug/,Rust and Neovim - A Thorough Guide and Walkthrough | the trait,This post is a detailed explanation and walkthrough of how I set up my Rust development environment and workflow with Neovim.,https://rsdlt.github.io/rsdlt-rust-ide-1.png,2022-09-22T01:32:36.267500137Z,https://news.ycombinator.com/item?id=32508843
https://arstechnica.com/science/2022/09/new-tech-can-make-your-house-a-solar-microgrid/,New tech can make your house a solar microgrid | Ars Technica,New version of support hardware can keep homes solar-powered during outages.,https://cdn.arstechnica.net/wp-content/uploads/2022/09/GettyImages-1362872948-2-760x380.jpg,2022-09-23T15:18:13.38522224Z,https://news.ycombinator.com/item?id=32938226
https://world.hey.com/jorge/aging-programmer-d448bdec,Aging programmer,"Back in college, they told me that I would start my career writing code, but eventually, I would move to a position where I would ask others to code my designs. To celebrate that this turned out to be completely false, here are some assorted reflections as a 40-year-old programmer that looks back: • Compared to my younger versions, I f...",https://world.hey.com/jorge/d448bdec/representations/eyJfcmFpbHMiOnsibWVzc2FnZSI6IkJBaHBCQlJ3eHpnPSIsImV4cCI6bnVsbCwicHVyIjoiYmxvYl9pZCJ9fQ==--20787dd2d61668d6cd045fde8e2b915063a76740/eyJfcmFpbHMiOnsibWVzc2FnZSI6IkJBaDdDRG9UY21WemFYcGxYM1J2WDJacGJHeGJCMmtDc0FScEFuWUNPZ3h4ZFdGc2FYUjVhUzA2Q25OMGNtbHdWQT09IiwiZXhwIjpudWxsLCJwdXIiOiJ2YXJpYXRpb24ifX0=--f2badd95ce31e495769e48a538e401dea1aca2ae/oziel-gomez-x7gz40Z9ObM-unsplash-2.jpg,2022-09-24T17:04:00.071672437Z,https://news.ycombinator.com/item?id=32961933
https://www.netmeister.org/blog/whois.html,"WHOIS: Fragile, unparseable, obsolete... and universally relied upon",A rather unstructured look at one of the older and infuriatingly trivial internet protocols: WHOIS,https://www.netmeister.org/blog/images/whodis.png,2022-09-24T17:05:09.741179082Z,https://news.ycombinator.com/item?id=32963417
https://davidamos.dev/the-rule-of-six/,Want cleaner code? Use the rule of six,A simple and powerful framework for ironing out confusing code.,https://davidamos.dev/content/images/2022/09/want_cleaner_code_header_image_wide-3.png,2022-09-25T02:50:07.359132278Z,https://news.ycombinator.com/item?id=32963021
https://alexanderell.is/posts/iphone-discoverability/,"iPhones and action discoverability, or ""How the hell was I supposed to know that?"" · Caffeinspiration",,,2022-09-25T02:58:37.970043885Z,https://news.ycombinator.com/item?id=32965288
https://www.lamag.com/citythinkblog/zodiac-killer-paul-alfred-doerr/,Has The Zodiac Killer Mystery Been Solved (Again),"For more than 50 years, his identity has remained as maddening a riddle as the ciphers he once sent police. but now an L.A. novelist-turned-amateur sleuth may have finally cracked the case",https://cdn2.lamag.com/wp-content/uploads/sites/6/2022/09/Zodiac-Cover-Illustration.jpg,2022-09-26T00:30:51.939210315Z,https://news.ycombinator.com/item?id=32964074
https://themarkup.org/newsletter/hello-world/lessons-from-a-professional-password-cracker,Lessons from a Professional Password Cracker – The Markup,A conversation with Jeremi Gosney,https://mrkp-static-production.themarkup.org/uploads/2022/05/3200x1800_hello-world-reduced-1200x628.jpg,2022-09-26T00:36:22.387028527Z,https://news.ycombinator.com/item?id=32961815
https://theprepared.org/features-feed/neon,Local Neon — The Prepared,How regional supply chains gave shape to the alluring glow of neon.,http://static1.squarespace.com/static/594027566b8f5b6f0abad495/t/6328a3b251c708148b1df8a2/1663607774918/1632px-The__Blue_Swallow_Motel__-_Tucumcari_%2815245360490%29.jpg?format=1500w,2022-09-26T00:37:22.582736116Z,https://news.ycombinator.com/item?id=32949494
https://www.bedelstein.com/post/mcmaster-carr,The Smartest Website You Haven't Heard of,lessons in UI design from an industrial supply company.,https://static.wixstatic.com/media/04d5b7_3f986ef8004a483d90d6aaaf43d13f94~mv2.png/v1/fit/w_1000%2Ch_1000%2Cal_c/file.png,2022-09-26T16:31:05.058999005Z,https://news.ycombinator.com/item?id=32976978
https://kottke.org/12/03/ballet-dancers-in-super-slow-motion,Ballet Dancers In Super Slow Motion,"Bless me Father Sloan, for I have committed a radical act on the Internet. I have watched this slow motion video of ballet dancers",https://img.youtube.com/vi/e4X5z8AQc3s/0.jpg,2022-09-26T16:44:09.687437653Z,
https://sixcolors.com/post/2022/09/iphone-14-pro-review-no-phone-is-an-island/,iPhone 14 Pro Review: No phone is an island – Six Colors,"Since the near-simultaneous arrival of the iPhone 8 and iPhone X in 2017, Apple has been on a mission to split the iPhone product line into two distinct sets of models: a more expensive set that in…",https://i0.wp.com/sixcolors.com/wp-content/uploads/2022/09/island-iphone-scaled.jpg?fit=1200%2C580&ssl=1,2022-09-26T22:42:20.446890528Z,
https://vivqu.com/blog/2022/09/25/outdated-apps/?utm_source=twitter,Outdated vs. Complete,"On August 22nd, I got an email out of the blue from Apple that notified me that I had a new App Review message. It was for my app, WorldAnimals, a light-hearted game for guessing animal onomatopoeia sounds in different languages.Usually, you receive a message after you submit a new version to the...",https://vivqu.com/assets/img/vivqu-photo.jpeg,2022-09-27T00:18:16.572497875Z,
https://www.cnn.com/travel/article/titanic-warning-ss-mesaba-irish-sea-intl-scli-scn/index.html,Scientists find wreckage of ship that tried to warn Titanic of iceberg | CNN Travel,The wreck of a ship that tried to warn the RMS Titanic of the iceberg that sank it on its maiden voyage has been found at the bottom of the Irish Sea.,https://cdn.cnn.com/cnnnext/dam/assets/220927102237-ss-mesaba-super-tease.jpg,2022-09-29T00:55:02.995536345Z,https://news.ycombinator.com/item?id=33013896
https://kerkour.com/learning-rust-sha1-hash-cracker,Learn Rust by implementing a SHA-1 hash cracker,"The moment has come to get your hands dirty: let&#39;s write your first Rust program. As for all the code examples in this course, you can find the complete code in the accompanying Git repository: https://github.com/skerkour/black-hat-rust $ cargo new sha1_cracker Will create a new project in the folder sha1_cracker. Note",https://kerkour.com/imgs/og_image.jpg,2022-09-30T02:30:49.951530045Z,https://news.ycombinator.com/item?id=33021496
https://arslan.io/2021/05/19/a-review-of-my-first-split-keyboard-moonlander-mk1/,My review of the Moonlander MK1 keyboard,"The Moonlander MK1 is an ergonomic, highly customizable split keyboard. I ordered one after I couldn’t stand anymore my hand and wrist pains. In this blog post, I want to share my keyboard journey, my experiences with the Moonlander, how I am using it and what I plan next.",https://arslan.io/content/images/2022/09/image-27.jpeg,2022-09-30T23:03:15.404094999Z,https://news.ycombinator.com/item?id=27209733
https://zignar.net/2022/10/01/new-lsp-features-in-neovim-08/,New LSP features in Neovim 0.8,"Personal weblog about programming, linux, life, the universe and everything",,2022-10-01T14:24:19.096545561Z,
https://zignar.net/2022/10/01/new-lsp-features-in-neovim-08/,New LSP features in Neovim 0.8,"Personal weblog about programming, linux, life, the universe and everything",,2022-10-01T22:23:18.844916519Z,https://news.ycombinator.com/item?id=33049116
https://eli.thegreenplace.net/2022/serving-static-files-and-web-apps-in-go/,Serving static files and web apps in Go - Eli Bendersky's website,,,2022-10-02T03:56:27.119295177Z,https://news.ycombinator.com/item?id=33048003
https://arslan.io/2019/01/07/using-the-ipad-pro-as-my-development-machine/,Using the iPad Pro as my development machine,I purchased an iPad Pro with the Smart Keyboard and Pencil to use as my main computer. Can it replace my local workstation? Is it powerful enough for my day-to-day tasks? Let's find out.,https://arslan.io/content/images/2022/09/image-19.jpeg,2022-10-03T01:17:55.496930534Z,https://news.ycombinator.com/item?id=19409907
https://src-bin.com/you-should-have-lots-of-aws-accounts/,Source & Binary / You should have lots of AWS accounts,An article about AWS and Substrate,https://src-bin.com/img/apple-touch-icon.png,2022-10-03T20:32:27.478641128Z,https://news.ycombinator.com/item?id=33069547
https://about.sourcegraph.com/blog/introducing-steve-yegge,"Steve Yegge joins as Head of Engineering (or, “Why I left retirement to join Sourcegraph”)","TL;DR: Steve Yegge has joined Sourcegraph as Head of Engineering, where we are building the world’s most open and comprehensive code intelligence platform (CIP).",https://storage.googleapis.com/sourcegraph-assets/about.sourcegraph.com/blog/2022/steve-yegge-joins-sourcegraph.png,2022-10-04T22:46:51.822665125Z,https://news.ycombinator.com/item?id=33082636
https://xai.sh/2020/10/16/Move-running-process-into-tmux-session.html,Move a running process into a tmux session | ./xai.sh,"It’s rare, but sometimes it still happens that I forget to open a tmux or screen session when working with something that is supposed to be quickly done. However, it also happens that “quickly done” turns into “tedious and ugly” and now the process lives longer than it was supposed to and I become afraid of ssh disconnects or something.",,2022-10-05T00:20:29.987558693Z,https://news.ycombinator.com/item?id=33086322
